Concat,Provider,Service,Ithrive,Description,Referral Process,Weblinks,Available for,Support Category,Age range,School Service,Referrer,Source,Reviewed?
Mid Kent Mind: Mental Health awareness training,Mid Kent Mind,Mental Health awareness training,Advice & Signposting,This session aims to build awareness of the prevalence of mental health and also help people to understand the particular problems and challenges which they or others may be facing.,access via weblink,https://midkentmind.org.uk/training/mental-health-awareness-training/,All,Anxiety/Depression/Low mood; Wellbeing,All ages,N,Self Referral,Sara Moreland commissioned,y-Diane
Mid Kent Mind: Youth Mental Health and Suicide Awareness course,Mid Kent Mind,Youth Mental Health and Suicide Awareness course,Advice & Signposting,"This course will give adults who work and care for young people, the skills and knowledge they need to start a conversation with someone who they believe is at risk. It will also provide information about other services in Kent and Medway which may be of help.",access via weblink,https://midkentmind.org.uk/training/youth-suicide-awareness/,All,Suicide support and suicide bereavement; Wellbeing; Anxiety/Depression/Low mood,All ages,N,Self Referral,Sara Moreland commissioned,y-Diane
National resource: ADFAM,National resource,ADFAM,advice & signposting,"is a national charity tackling the effects of alcohol, drug use or gambling on family members and friends through information and local support groups. They have a range of publications and resources for professionals.",,https://adfam.org.uk/,All,Health; Family Support,All ages,N,Self Referral,recommended on local offer,y-Diane
National resource: Altogether extraordinary,National resource,Altogether extraordinary,advice & signposting,An online and in-person support group for carers of children who are Neurodiverse. No diagnosis necessary . All welcome.,,https://www.facebook.com/AltogetherExtraordinary/?form=MY01SV&OCID=MY01SV,All,Special Educational Needs and Disability/ Autism/ADHD,All ages,N,No referral required,Kent local offer,y-Diane
National resource: Anna Freud,National resource,Anna Freud,Thriving,"provides support to schools, colleges and education professionals through online advice, guidance and resources. Schools in Mind is a free network for education professionals which shares practical, academic and clinical expertise about mental health and wellbeing in schools and FE colleges.",,https://www.annafreud.org/schools-and-colleges/,"For professionals, families and children and young people",Anxiety/Depression/Low mood; Bereavement; Wellbeing; Eating Disorder,All ages,N,No referral required,DFE/Recommended by DfE,y-Diane
National resource: Antibullying alliance,National resource,Antibullying alliance,thriving,"A unique coalition of organisations and individuals, working together to achieve our vision to stop bullying and create safer environments in which children and young people can live, grow, play and learn. They provide expertise in relation to all forms of bullying between children and young people.",,https://anti-bullyingalliance.org.uk/tools-information,All,Bullying,All ages,N,No referral required,DFE/Recommended by DfE,y-Diane
National resource: Anxiety Canada ,National resource,Anxiety Canada ,Advice & Signposting,Anxiety Canada's mission is to reduce the barrier of anxiety and related disorders so people can live the life they want. We offer trusted resources and programs to help individuals find relief from anxiety and obsessive compulsive disorder (OCD).,No referral needed,https://www.anxietycanada.com/,All,"Anxiety/Depression/Low mood; Diagnosed mental health e.g. OCD, Psychosis, Personality Disorder",Secondary School Age and post 16,N,No referral required,Recommended by CAMHS,y-Diane
National resource: Anxiety uk,National resource,Anxiety uk,Advice & Signposting,"Anxiety uk helps those suffering with anxiety disorders they offer self help groups, counselling, phone self help groups and email support",phone service: 08444775774 weekdays 9:30 - 17:30 text service 07537416905,https://www.anxietyuk.org.uk/,All,Anxiety/Depression/Low mood,All ages,N,Self Referral,YMHFA Manual,y-Diane
National resource: Around the Dinner Table,National resource,Around the Dinner Table,advice & signposting,"Free service provided for parents of those suffering from eating disorders. Moderated by kind, experienced parent caregivers trained to guide you in how to use the forum and how to find resources to help you support your family member",,https://www.aroundthedinnertable.org/,All,Family Support; Eating Disorder,All ages,N,No referral required,NHS recommended,y-Diane
National resource: At a loss ,National resource,At a loss ,Advice & Signposting,Support with signposting to national and local services,,https://www.ataloss.org/,All,Bereavement,All ages,N,No referral required,,y-Diane
National resource: Autistica,National resource,Autistica,Advice & Signposting,"Autistica is an autism research and campaigning charity. They provide some information and resources in relation to suicide, including supporting mental health and coping with uncertainty. They have produced a helpful guide on: Supporting autistic children and young people through crisis.",No referral process,https://www.autistica.org.uk/what-is-autism/suicide-and-autism,All,Special Educational Needs and Disability/ Autism/ADHD,All ages,N,No referral required,K&m Suicide autism & suicide doc,y-Diane
National resource: Baby Loss awarness Alliance,National resource,Baby Loss awarness Alliance,"Getting Help
(goals based)",A range of different support offers that help provide the right support for you if you have suffered a baby loss.,,https://babyloss-awareness.org/support/,All,Bereavement; Family Support,All ages,N,Self Referral,NHS recommended,y-Diane
National resource: Barnardo�s Education Community,National resource,Barnardo�s Education Community,thriving,"an online resource to help support teachers, lecturers and staff working in the education sector. A one stop shop where educators can go for trauma-informed resources, support and advice about how to help children and young people cope with any issues they are experiencing.",,https://www.educators-barnardos.org.uk/,All,Trauma/Victim support,All ages,N,No referral required,DFE/Recommended by DfE,y-Diane
National resource: Barnardo's Believe in Children,National resource,Barnardo's Believe in Children,Advice & Signposting,"Provide a range of services to help and support families across the UK, working with organisations and professionals so that children get the best start in life.",,https://www.barnardos.org.uk,All,Wellbeing,All ages,N,No referral required,tonic signposting document,y-Diane
National resource: BBC Bitesize,National resource,BBC Bitesize,advice & signposting,"offers support, advice and tips to children and young people on a host of areas including mental health, wellbeing, resilience, identity and healthy relationships.",,https://www.bbc.co.uk/bitesize/collections/life-and-wellbeing/1,All,Anxiety/Depression/Low mood; Wellbeing,All ages,N,No referral required,DFE/Recommended by DfE,y-Diane
National resource: BEAT,National resource,BEAT,Advice & Signposting,"Beat is the UKs leading charity that helps to support people who are affected by eating disorders.

Their website has a wide range of information on different eating disorders including anorexia, bulimia, binge eating disorder and other eating and feeding problems.

They have lots of information on how to cope and recovery. As well as this they have information on how to support someone who is going experiencing an eating disorder. They have helplines as well as one-to-one web chats if you feel more comfortable with that.","Helpline: 0808 801 067
Youthline: 0808 801 0711
Studentline: 0808 801 0811
Email: help@beateatingdisorders.org.uk",https://www.beateatingdisorders.org.uk/,All,Eating Disorder,All ages,N,Self Referral,DFE/Recommended by DfE,y-Diane
National resource: BEAT Parents,National resource,BEAT Parents,advice & signposting,"Skills workshops for carers and those supporting someone with an eating disorder. 
Online support groups for both those suffering and for carers including various chat rooms
 A booklet for parents, families, friends and carers can be accessed here which covers information about eating disorders and treatment and offers guidance on how you might approach the subject if youre worried about someone you know.
 The BEAT helpline encourages and supports people to access early treatment
 Tips poster: spotting the first signs and symptoms is extremely important and this poster provides tips on how to spot the very first signs of an eating disorder.
 Directory of local services: https:helpfinder.beateatingdisorders.org.uk Peer coaching: https:www.beateatingdisorders.org.uksupport-servicesecho-peer-coaching",,"https://www.beateatingdisorders.org.uk/get-information-and-support/support-someone-else/support-for-carers/#:~:text=Support%20for%20Carers%20Beat%20has%20published%20guidance%20encouraging,needs%20and%20offering%20access%20to%20peer-to-peer%20support%20programmes.",All,Family Support; Eating Disorder,All ages,N,No referral required,DFE/Recommended by DfE,y-Diane
National resource: BEAT school resources,National resource,BEAT school resources,Thriving,"Spot the Signs appeal includes:
 Discussion-starter film including Know the First Signs 
 Teachers Guide with short tutorial-plan
 Assembly plan",,https://www.beateatingdisorders.org.uk/,All,Eating Disorder,All ages,Y,No referral required,DFE/Recommended by DfE,y-Diane
National resource: BECOME,National resource,BECOME,Advice & Signposting,"A friendly helpline for children in care and young care leavers. You can call or email to get help, support, advice, guidance  or just to get in touch with someone to listen to you. Our Care Advice team are here to help you with what you need and treat you in the way you deserve to be treated  with respect and understanding. Speak to the dedicated Care Advice team who have extensive knowledge about the care system and help care-experienced young people who face difficult situations every single day. The friendly team will listen without judgement, and help you with the issue you may be facing.",Call 08000232033 or email advice@becomecharity.org.uk or use the online contact form,https://becomecharity.org.uk/get-support/care-advice-line/,Children in Care/Care leavers,Bullying; Anxiety/Depression/Low mood; Behaviour; Wellbeing; Social Care,All ages,N,Self Referral,Medway Care leavers services and information guide,y-Diane
National resource: Beech House,National resource,Beech House,"Getting Help
(goals based)","Offers free, confidential healthcare and compassionate support to people of all ages in Kent and Medway that have experienced sexual assault or rape in their lifetime.",Call for support and to discuss your options for an in-person appointment and/ or referrals,"https://beechhousesarc.org/#:~:text=Sexual%20Assault%20Referral%20Centre,every%20day%20of%20the%20year",All,Trauma/Victim support,All ages,N,Self Referral,tonic signposting document,y-Diane
National resource: Beyond Cove,National resource,Beyond Cove,Thriving,Clinically approved to help you self-manage your mental health using music therapy principles in an easy and enjoyable way.,,https://cove-app.com/,All,Wellbeing,All ages,N,No referral required,ch team SH PowerPoint,y-Diane
National resource: Blurt it out,National resource,Blurt it out,Advice & Signposting,can help you if youre struggling with depression. A range of support services that can help see you through tough times.,,https://www.blurtitout.org/,Aged 16+,Anxiety/Depression/Low mood,Post 16,N,No referral required,ICB z-card,y-Diane
National resource: Calm Harm App,National resource,Calm Harm App,Advice & Signposting,"The Calm Harm app provides some immediate activities and techniques to help you break the cycle of self-harm behaviour and explore underlying trigger factors; the app supports you in building a safety net of helpful thoughts, behaviours, and access to supportive people, as well as providing the opportunity to journal and self-reflect. The Calm Harm app also signposts to help.",No referral needed,https://calmharm.stem4.org.uk,ages 13+,Self harm; Anxiety/Depression/Low mood,Secondary School Age and post 16,N,No referral required,Recommended by CAMHS and YMHFA Manual,y-Diane
National resource: CALM zone,National resource,CALM zone,Advice & Signposting,"CALM runs a free and confidential helpline and web chat 7 hours a day, 7 days a week for anyone who needs to talk through any problems.

They aim to reduce the rates of suicide by providing a listening ear.

As well as helping people who are going through crisis, they also help to support those who are bereaved by suicide.

They also provide resources and advice regarding specific issues and concerns you may have, as well as other organisations who may be able to provide you with additional help.",Phone: 0800 58 58 58,https://www.thecalmzone.net/,All,"Anxiety/Depression/Low mood; Homelessness, finance, employment; Bereavement; Suicide support and suicide bereavement",All ages,N,Self Referral,YMHFA Manual,y-Diane
National resource: Charlie Waller Trust,National resource,Charlie Waller Trust,advice & signposting,"offers advice, guidance and resources for schools and education professionals to support children and young peoples mental health and wellbeing. The website also includes resources for parents and carers and young people including practical advice and information and workshops.",,https://charliewaller.org/,Professionals & parents,Anxiety/Depression/Low mood; Wellbeing; Eating Disorder; Family Support; Health,All ages,Y,No referral required,DFE/Recommended by DfE,y-Diane
National resource: Child Bereavement UK,National resource,Child Bereavement UK,advice & signposting,"helps children and young people (up to age 25), parents, and families, to rebuild their lives when a child grieves or when a child dies. They also provide training to professionals.",,https://www.childbereavementuk.org/,All,Bereavement,All ages,N,No referral required,DFE/Recommended by DfE,y-Diane
National resource: Childhood Bereavement Network,National resource,Childhood Bereavement Network,Advice & Signposting,"The Childhood Bereavement Network shares the vision that all children and young people in the UK, together with their caregivers, can easily get a choice of high quality local and national information, guidance and support, to help them to manage the impact of death on their lives.

They can provide you with information on how to cope with any emotions you may feel associated with the death of a loved one.",cbn@ncb.org.uk,http://www.childhoodbereavementnetwork.org.uk/,All,Bereavement,All ages,N,Self Referral,YMHFA Manual,y-Diane
National resource: ChildLine,National resource,ChildLine,Advice & Signposting,1-2-1 chat about anything worrying individuals,call 0800 1111 or use the link to start a chat; https://www.childline.org.uk/get-support/1-2-1-counsellor-chat/,https://www.childline.org.uk/,All,Anxiety/Depression/Low mood,All ages,N,Self Referral,DFE/Recommended by DfE,y-Diane
National resource: Citizen's advice,National resource,Citizen's advice,Advice & Signposting,"We give people the knowledge and confidence they need to find their way forward - whoever they are, and whatever their problem. Our national charity and network of local charities offer confidential advice online, over the phone, and in person, for free.",https://www.citizensadvice.org.uk/about-us/contact-us/contact-us/contact-us1/,https://www.citizensadvice.org.uk/,All,"Homelessness, finance, employment",All ages,N,Self Referral,national,y-Diane
National resource: Crisis tools,National resource,Crisis tools,advice & signposting,"Unique, co-produced learning guides to increase knowledge and confidence for anyone supporting young people in a mental health crisis. Crisis Tools is relevant to anyone who may find themselves supporting a young person in crisis including parents, carers and professionals.

The Crisis Tools website features a resource sharing hub and bite-sized learning guides aimed at improving your knowledge and understanding of young peoples experiences when getting help in crisis.",,https://crisistools.org.uk/,Age 0-25,Family Support; Anxiety/Depression/Low mood,All ages,N,No referral required,recommended by HEE,y-Diane
National resource: CXK,National resource,CXK,advice & signposting,"delivers a range of services to empower young people and adults across the South-East to build the skills and confidence they need to move into education, employment or training. They deliver careers information, advice and guidance; advocating skills development; and providing dedicated support to help people
progress into employment, training or learning. They can help parentscarers that have been made redundant, furloughed or just seeking careers advice, work or training opportunities to provide support and direction. Practical help is available with CV writing, interview skills and job searches.","To make an appointment please call the dedicated referral line on 01233 224 244  or email the customer name, telephone number and email address to nationalcareers@cxk.org and they will contact the customer to book them in.",https://www.cxk.org/our-services/,All,"Homelessness, finance, employment",All ages,N,Self Referral,Tamsyn Phillips reccomended/worked with for participation,y-Diane
National resource: Dandelion Time,National resource,Dandelion Time,advice & signposting,"The children we work with have often been affected by the harshest personal circumstances, having been traumatised by experiences including physical or sexual abuse, domestic violence, or neglect.  The emotional landscape for these children is often bleak, their difficulties culminating repeated exclusions or refusal to engage at school, and a breakdown in relationships at home.  They are often extremely isolated, and as a result of emotional trauma may be experiencing aggressive or withdrawn behaviour, or suffer from depression, anxiety or low self-esteem.  Referred children sometimes also have diagnoses of physical or emotional disorders including ADHD or Autistic Spectrum Disorders. Trauma itself has a dramatic effect on key areas of development in early childhood, leading to under-developed physical and sensory abilities and motor skills, or eating disorders.  We work with children to help them overcome these issues. NOTE: see financial contribution required",01622 814001; https://dandeliontime.org.uk//referrals/,https://dandeliontime.org.uk/,All,Anxiety/Depression/Low mood; Trauma/Victim support; Behaviour; Special Educational Needs and Disability/ Autism/ADHD,All ages,N,Self Referral,Approved by the group,y-Diane
National resource: Ditch the label,National resource,Ditch the label,advice & signposting,"a global youth charity, here to help young people aged 12 to 25 navigate the issues affecting them the most; from mental health and bullying to identity, Asian hate crimes and relationships",,https://www.ditchthelabel.org/,Age 12-25,Cultural Identity & Migration Support; Anxiety/Depression/Low mood; Bullying,Secondary School Age and post 16,N,No referral required,DFE/Recommended by DfE,y-Diane
National resource: Education support resources,National resource,Education support resources,Thriving,"Discover articles, videos and guides to help you and your organisation with mental health and wellbeing.",,https://www.educationsupport.org.uk/resources/,All,Anxiety/Depression/Low mood; Bereavement; Wellbeing,All ages,Y,No referral required,recommended by Anna Freud,y-Diane
National resource: Educational Action Challenging Homophobia (EACH),National resource,Educational Action Challenging Homophobia (EACH),advice & signposting,"offers advice and support online and through their freephone Helpline for children experiencing homophobic, biphobic or transphobic bullying or harassment.",call 0808 1000 143 open Monday to Friday 10am to 5pm,https://each.education/education-schools-training,All,LGBTQIA+; Bullying,All ages,N,Self Referral,DFE/Recommended by DfE,y-Diane
National resource: Ellies Angels ,National resource,Ellies Angels ,Advice & Signposting,"a non-profit organisationcommunity mainly made up of young people, working with professionals, schools and health colleagues to better support childrens mental health through awareness. They have amazingly created an app called Better U, which can be accessed on app stores to download to a mobile. This app was created by young people for young people, and I would recommend this as an additional digital support in terms of signposting and resource.",Contact section on website,https://www.elliesangels.org,All,Anxiety/Depression/Low mood; Wellbeing,"Primary school age, Secondary School age and post 16",N,Self Referral,work with NHS regularly and in SH guidance,y-Diane
National resource: everyone's invited,National resource,everyone's invited,advice & signposting,"A movement committed to eradicating rape culture. Trigger warning for the survivor testimonies: Rape and sexual assault abuse (physical, mental, emotional, verbal, sexual), eating disorders, self-harm, suicide or suicidal ideation, violence, child abuse and paedophilia.",,https://www.everyonesinvited.uk,All,Trauma/Victim support; Eating Disorder; Self harm; Anxiety/Depression/Low mood,All ages,N,No referral required,DFE/Recommended by DfE,y-Diane
National resource: F.E.A.S.T.,National resource,F.E.A.S.T.,advice & signposting,A global community of parents and those who support parents who children have eating disorders.,,https://feast-ed.org/,All,Eating Disorder,All ages,N,No referral required,NHS recommended,y-Diane
National resource: Frank,National resource,Frank,advice & signposting,"Provides information on drugs, their effects and the law. It also offers support for parents and young people",,https://www.talktofrank.com/,All,Health,All ages,N,No referral required,Approved by the group,y-Diane
National resource: FREED,National resource,FREED,Thriving,"Free to NHS staff; Online platform consisting of 8 modules Module 
1: Introduction to FREED
Module 2: The FREED Service Model and Champion
Module 3: FREED Assessments
Module 4: The FREED Care Package
Module 5: Family Involvement
Module 6: The FREED Network
Module 7: Making a Business Case
Module 8: Implementation Success which are free to access.",,https://www.freedfromed.co.uk/freed-for-professionals,All,Eating Disorder,All ages,N,No referral required,NHS recommended,y-Diane
National resource: Grief Encounter,National resource,Grief Encounter,advice & signposting,"Offers support and resources for children, young people and professionals.",,https://www.griefencounter.org.uk/,All,Bereavement,All ages,N,Self Referral,recommended by BBC,y-Diane
National resource: Supporting pupils with medical conditions,National resource,Supporting pupils with medical conditions,Thriving,Guidance around supporting pupils with medical conditions,,http://www.gov.uk/government/uploads/system/uploads/attachment_data/file/349435/Statutory_guidance_on_supporting_pupils_at_school_with_medical_conditions.pdf,All,Special Educational Needs and Disability/ Autism/ADHD; Wellbeing,All ages,Y,No referral required,government site,y-Diane
National resource: Guide for referring CYP with Eating Disorders,National resource,Guide for referring CYP with Eating Disorders,advice & signposting,Healthy London Partnership has produced guidelines for primary care professionals about treating children and young people with eating disorders. The guidelines are being dispatched to GP practices across London to coincide with Eating Disorders Awareness Week.,,https://www.beateatingdisorders.org.uk/,All,Eating Disorder,All ages,N,No referral required,NHS recommended,y-Diane
National Resource: Heads Above The Waves ,National Resource,Heads Above The Waves ,Advice & Signposting,Heads Above The Waves is a not-for-profit organisation that raises awareness of depression and self-harm in young people.,"No referral process, information and advice",https://hatw.co.uk/helplines/ ,11-25 year olds,Anxiety/Depression/Low mood; Self harm,Secondary School Age and post 16,N,No referral required,ch team SH resource PowerPoint,y-Diane
National resource: Headspace for Educators,National resource,Headspace for Educators,Thriving,"Whether youre feeling inspired to connect more with your students or youre looking for a new way to bring calm to your classroom, Headspace can help students build healthy habits that last a lifetime. Better focus, less stress, and happier thoughts are just a few minutes away.",,https://www.headspace.com/educators,All,Behaviour; Wellbeing,All ages,Y,No referral required,YMHFA Manual,y-Diane
National resource: Healthy London partnership,National resource,Healthy London partnership,advice & signposting,Guidelines giving advice about spotting the signs of eating disorders and when to refer children and young people to local community eating disorder services for specialist support.,,https://www.healthylondon.org/wp-content/uploads/2020/03/Eating-Disorders-Advice_Nov-2019_Final-1.pdf,All,Eating Disorder,All ages,Y,No referral required,NHS recommended,y-Diane
National resource: Help is at hand ,National resource,Help is at hand ,advice & signposting,"Support Guide after someone may have died by suicide. To help families, friends and loved ones.",,https://supportaftersuicide.org.uk/resource/help-is-at-hand/,All,Bereavement,All ages,N,No referral required,Recommended by Public Health England,y-Diane
