Concat,Provider,Service,Ithrive,Description,Referral Process,Weblinks,Available for,Support Category,Age range,School Service,Referrer,Source,Reviewed?
National resource: Teen Sleep Hub,National resource,Teen Sleep Hub,advice & signposting,"Offers advice, support and tips on achieving a good nights sleep. They have information and resources for secondary schools, teens and young people and parents and carers.",,https://teensleephub.org.uk/,Age 11-16,Behaviour; Family Support; Health,Secondary School Age (11-16),N,No referral required,DFE/Recommended by DfE,y-Diane
National resource: the autism apprentice,National resource,the autism apprentice,Advice & Signposting,"work with families who have a young person with SEND, specialising in autism spectrum conditions, attention deficit hyperactivity disorder and associated co-morbid conditions. The aims of this project are to support those families who do not yet have a formal diagnosis but the parentcarer or educational setting have observed traits and have highlighted concerns. They offer a private consultancy service, please contact them directly for further information.",Tel: 03000 110 300 or email info@autismapprentice.co.uk,https://www.autismapprentice.co.uk/,All,Special Educational Needs and Disability/ Autism/ADHD,All ages,N,Self Referral,K&m Suicide autism & suicide doc,y-Diane
National resource: The Good Grief Trust ,National resource,The Good Grief Trust ,Advice & Signposting,"The Good Grief Trustexists to help all those affected by grief in the UK. The Trust helps those bereaved from day one, acknowledges their grief and provides reassurance, a virtual hand of friendship and ongoing support.",Find support section on website ,https://www.thegoodgrieftrust.org/,All,Bereavement,All ages,N,No referral required,NHS recommended,y-Diane
National resource: The Mix,National resource,The Mix,"Getting Help
(goals based)","Can help you take on any challenge youre facing. From Mental health to money, homelessness to finding a job or relationship or family break-ups to
drugs. Talk to them via the online community, social media, free, confidential helpline (0808 808 4994 ) or counselling service.",call 08088084994,https://www.themix.org.uk,Under 25 years old,"Anxiety/Depression/Low mood; Homelessness, finance, employment",All ages,N,Self Referral,DFE/Recommended by DfE,y-Diane
National resource: The WorryBox,National resource,The WorryBox,Advice & Signposting,This app helps you to manage your worries. For age 4-11 years. (Search your Apple or Google Play store to download.),No referral needed,https://www.worryboxapp.com/,4-11 years ,Anxiety/Depression/Low mood,Primary School age (5-11 years old),N,No referral required,Recommended by CAMHS,y-Diane
National resource: Think Ninja,National resource,Think Ninja,advice & signposting,"An app which educates children and young people about mental health, emotional wellbeing and provide skills young people can use to build resilience and stay 
well.",,https://apps.apple.com/gb/app/thinkninja/id1425884328,Age 10-18,Anxiety/Depression/Low mood; Wellbeing,"Primary school age, Secondary School age and post 16 ",N,No referral required,DFE/Recommended by DfE,y-Diane
National resource: Togetherall,National resource,Togetherall,advice & signposting,offers an online community for YP 16-18 in need of mental health support. Includes self assessments and recommended resources and self guided courses. Previously known as big white wall,,https://www.togetherall.co.uk,Aged 16-18,Anxiety/Depression/Low mood; Wellbeing,Post 16,N,No referral required,NHS,y-Diane
national resource: Trans Voices,national resource,Trans Voices,Thriving,Trans Voices is the UKs first professional trans choir,,https://www.transvoices.co.uk/,Transgender individuals,LGBTQIA+,All ages,N,Self Referral,Lottery funded and supported by Arts council England,y-Diane
National resource: UK Trauma Council,National resource,UK Trauma Council,advice & signposting,"A free  evidence based resource for school staff, bereavement services and NHS mental health services to help identify and support children and young people who are experiencing a traumatic bereavement. 
 
Traumatic bereavement may be easily missed or misunderstood, meaning that childrens difficulties are not recognised. It is vital that these children are identified and given appropriate help and support.",,https://uktraumacouncil.org/resources/traumatic-bereavement,All,Bereavement,All ages,Y,No referral required,hosted by anna Freud,y-Diane
National resource: Unlock Wellbeing,National resource,Unlock Wellbeing,"Getting Help
(goals based)","University of Bath, funded by NIHR have developed 3 research studies for children and young people, providing free and easy to access single session support interventions on the new platform ""unlock wellbeing"" . Take a look at their site to find out how children and young people can take part and how it can support them;
Project Y.E.S; Youth Empowerment Support for low mood or a wellbeing boost age 13-25.
Project Sleep; age 13-25 support to improve sleep
Project Body Neutrality UK; age 13-21 support to help young people develop better relationships with their body image.",access via weblink,https://unlockwellbeing.org.uk/young-people/take-part-in-a-study/,All,Health; Anxiety/Depression/Low mood; Wellbeing,All ages,N,Self Referral,reccomended by NELFT,y-Diane
National resource: Victim Support,National resource,Victim Support,"Getting Help
(goals based)","Victim Support's youth programme which helps children and young people cope with the impact and effects of crime. Young people do not have to report a crime to get support from us. Victim Support also provide a free service for children, young people and their parents to help support children who've been affected by crime.",,https://www.victimsupport.org.uk,All,Trauma/Victim support,All ages,N,No referral required,PHCH- Medway Care leavers services and information guide,y-Diane
National resource: We can talk,National resource,We can talk,Thriving,"Support to increase knowledge, confidence and skill in supporting children and young peoples mental health. 
 It utilises a co-produced (with hospital staff, young people and mental health experts) evidence-based education framework to give all staff who see children and young people the core competencies to support their mental health needs.
 We Can Talk is suitable for anyone who encounters children and young people in an acute hospital setting including nurses, HCAs, doctors, students, trainees and non-clinical staff.",,https://wecantalk.online/,All,Eating Disorder,All ages,N,No referral required,NHS recommended,y-Diane
National resource: WhatsUp? � App,National resource,WhatsUp? � App,Thriving,"WhatsUp? provides daily tools that promote positive mental health and wellbeing for everyone in your organisation. Secure, confidential and non-judgmental it allows your wellbeing department to instantly support those that need help most",,https://www.thewhatsupapp.co.uk/,18 and over,Wellbeing,Post 16,N,No referral required,ch team SH PowerPoint,y-Diane
National resource: Whole School Approach,National resource,Whole School Approach,Thriving,"A whole-school approach involves all parts of the school working together and being committed. It needs partnership working between senior leaders, teachers and all school staff, as well as parents, carers and the wider community.",,https://www.annafreud.org/news/framework-launched-to-support-schools-to-develop-whole-school-approach-to-mental-health/,Schools,Wellbeing,All ages,Y,No referral required,DFE/Recommended by DfE,y-Diane
National resource: Winston's wish,National resource,Winston's wish,Advice & Signposting,Support for families bereaved by and dealing with loss from suicide,Helpline 08088020021,https://www.winstonswish.org/death-through-suicide/,All,Bereavement,All ages,N,Self Referral,Approved by the group and recommended by public health England,y-Diane
National resource: Young Minds � Professionals,National resource,Young Minds � Professionals,Advice & Signposting,"The young minds resource library is full of toolkits, publications, reports and policy information about CYPs mental health. Training and consultancy is available for schools.  CYPs pages contain information on getting urgent help, medication, specific conditions and looking after yourself.","No referral process, book training on website",https://www.youngminds.org.uk/professional/,All,Anxiety/Depression/Low mood; Wellbeing,All ages,Y,No referral required,DFE/Recommended by DfE,y-Diane
National resource: Young minds-Parent,National resource,Young minds-Parent,Advice & Signposting,"The young minds resource library is full of toolkits, publications, reports and policy information about CYPs mental health.  Various pages available for both parents and children and young people containing information on getting urgent help, medication, specific conditions and looking after yourself and a parent helpline.",parent helpline Monday to Friday 9.30pm - 4pm 0808 802 5544,https://www.youngminds.org.uk/parent/parents-a-z-mental-health-guide/self-harm/,All,Anxiety/Depression/Low mood; Family Support; Wellbeing,All ages,N,Self Referral,DFE/Recommended by DfE,y-Diane
National resource: Youth Access,National resource,Youth Access,"Getting Help
(goals based)","Counselling, advice and information services for young people",,https://www.youthaccess.org.uk/,All,Anxiety/Depression/Low mood,All ages,N,No referral required,DFE/Recommended by DfE,y-Diane
National resource: Zero Suicide Alliance,National resource,Zero Suicide Alliance,Advice & Signposting,"The Zero Suicide Alliance have produced a free, online Autism and Suicide Awareness training session co-produced with the autistic community.",No referral process,https://www.zerosuicidealliance.com/autism-suicide-training,All,Special Educational Needs and Disability/ Autism/ADHD; Suicide support and suicide bereavement,All ages,N,No referral required,K&m Suicide autism & suicide doc,y-Diane
National resource : Little troopers therapy programme ,National resource ,Little troopers therapy programme ,Advice & Signposting,Little troopers therapy programme offers one to one psychotherapy sessions and community therapy groups for those whose parents serve in the British armed forces These sessions are focused on  supporting children who feel particularly impacted specifically by the challenges that military life can bring such as a parent being deployed or moving schools or homes frequently.,info@littletroopers.net,https://www.littletroopers.net/,Under 18s ,Armed forces,"Primary school age, Secondary School age and post 16",N,,reccomended by space matters newsletter,y-Diane
National resource : No Panic ,National resource ,No Panic ,Advice & Signposting,"No panic is a charity which helps people who suffer from panic attacks, phobias, obsessive compulsive disorders and other related disorders including those people who are trying to give up tranquillizers",,https://www.nopanic.org.uk,All,Anxiety/Depression/Low mood; Wellbeing,All ages,N,No referral required,YMHFA Manual,y-Diane
National resource : OCD action,National resource ,OCD action,Advice & Signposting,Information and support for obsessive compulsive disorders (OCD) and other related disorders including body dysmorphic disorders (BDD) skin picking (CSP) trichotillomania (TTM) compulsive hair pulling,Support@ocdaction.org.uk ,https://www.ocdaction.org.uk ,All,"Diagnosed mental health e.g. OCD, Psychosis, Personality Disorder",All ages,N,Self Referral,YMHFA Manual,y-Diane
National resource : Parental Education Growth Support - PEGS ,National resource ,Parental Education Growth Support - PEGS ,Advice & Signposting,"PEGS is a social enterprise set up to support parents, carers and guardians who are experiencing Child to Parent Abuse (including those with adult offspring). They offer group workshops as well as some 1-1 work.","hello@pegsupport.com, Referral form on website � parents can self-refer or professional can do it on their behalf. ",https://www.pegsupport.co.uk/,Parents,Family Support; Trauma/Victim support,All ages,N,Self/Professional referral,recommended by DSS,y-Diane
National resource : Rethink mental illness ,National resource ,Rethink mental illness ,Advice & Signposting,"Rethink is a national mental health charity, their aim to work to help everyone affected by severe mental health illness to recover for a better quality of life. They try to make positive differences by providing hope through effective services, information and support.",info@rethink.org.uk / advice@rethink.org.uk,https://www.rethink.org,All,Wellbeing,All ages,N,Self Referral,YMHFA Manual,y-Diane
National resource : Stamp out suicide ,National resource ,Stamp out suicide ,Advice & Signposting,"Stamp out suicide offers points of contact for those feeling suicidal, those bereaved by suicide or concerned about suicide", info@stampoutsuicide.co.uk,https://www.stampoutsuicide.co.uk/,All,Bereavement,All ages,N,Self Referral,YMHFA Manual,y-Diane
Kent and Medway Mental Health NHS Trust: All age Eating disorder service,Kent and Medway Mental Health NHS Trust,All age Eating disorder service,"Getting more help
(specialist)","The All Age Eating Disorder Service for Kent and Medway is a specialist service. Our service aims to bring hope and confidence, through help and support, to those who have an eating disorder. 

The All age eating Disorder Service accept referrals for:
	Anorexia Nervosa
	Bulimia Nervosa
	Binge Eating Disorder
	Other Specified feeding or eating disorder (OSFED)

The types of support we offer are:
	Online and guided self help
	Family therapy
	Individual cognitive behaviour therapy-E
	Group Work
	Psychiatric Medical Assessment and Reviews
	Dietetic advice and support","The All Age Eating Disorder Service accept self- referrals. 
A Duty Clinician is available Monday to Friday 9-5 to discuss referrals on 0300 300 1980.
We accept referrals from age 8 onwards.
The Duty clinician is available for consultation to agencies as well.
The All Age Eating Disorder Service also accept referrals from GP�s and other medical professionals. ",https://www.nelft.nhs.uk/services-kent-medway-eating-disorders,All,Eating Disorder,"Primary school age, Secondary School age and post 16",N,Self/Professional referral,Commissioned,y-Diane
Kent and Medway Mental Health NHS Trust: Crisis team for Children and Young People,Kent and Medway Mental Health NHS Trust,Crisis team for Children and Young People,Risk Support,"The NELFT Kent and Medway Crisis and Home Treatment Team offer short term intervention for young people who are presenting in mental health crisis. Our aim is to prevent admission to tier 4 services by seeing young people in the community for a short period of time alongside the locality teams.  
We assess young people who present to AE or have been referred from their locality teams with significant mental health concerns, and we offer short term support for several weeks in the community following their presentation. We can see young people in AE, locality teams, homes, schools, or the local community if preferred by the young person. Our contacts are either face to face or via telephone. 
If a young person requires admission to tier 4 services, the crisis team will support the young person until a bed has been identified. 
The crisis team also support young people who have been detained on a section 136 and are currently placed in our health based place of safety.","Via NELFT locality teams (across Kent and Medway) � Internal
Via NELFT single point of access or mental health direct � internal 
Via acute trusts (A&E or acute wards)� 0300 555 1080",,All,Anxiety/Depression/Low mood; Behaviour; Self harm,All ages,N,Professional referral,Commissioned,y-Diane
Kent and Medway Mental Health NHS Trust: Kent & Medway Complex Autism Service (KAMCAS),Kent and Medway Mental Health NHS Trust,Kent & Medway Complex Autism Service (KAMCAS),Advice & Signposting,Tertiary specialist service commissioned to support adults with complex presentations and a confirmed diagnosis of autism where other professionals within the mental health and the care system are unable to meet the persons needs effectively.,call 01732792044,https://sinclairstrong.co.uk/service/kent-medway-complex-autism-service-kamcas/,Aged 18-25,Behaviour; Special Educational Needs and Disability/ Autism/ADHD,Post 16,N,Professional referral,Commissioned by Medway LDA commissioners,y-Diane
Kent and Medway Mental Health NHS Trust: Medway Young Person's wellbeing service,Kent and Medway Mental Health NHS Trust,Medway Young Person's wellbeing service,"Getting more help
(specialist)","The Medway Young Persons' Wellbeing Service provides emotional wellbeing and mental health advice and support for young people and their families.

The Medway Young Persons' Wellbeing Service offers advice and support for:
 stress
 low mood 
 depression
 anxiety
 self-harm 
 difficult to manage behaviours as well as support for neurodevelopmental difficulties such as ADHD or ASD.

The way in which support is offered differs from young person to young person depending on the type and severity of concern. For some young people their emotional well-being may be having a significant impact on their day to day life and in these cases the YPWS may offer a short period of face to face or virtual support either in 1:1 sessions or in a group. All NELFTs direct support options aim for young people to meet their own goals. These include: online selfhelp; sign-posting to other organisations; crisis support; specialist assessments; face to face or virtual therapy either individually or in groups
Young people who have been discharged can refer themselves back into the service at any time.",Self refer or consultation on 08000113474,https://www.nelft.nhs.uk/services-kent-children-young-peoples-mental-health/,All,Anxiety/Depression/Low mood; Self harm; Behaviour; Special Educational Needs and Disability/ Autism/ADHD,All ages,N,Self/Professional referral,Commissioned,y-Diane
Kent and Medway Mental Health NHS Trust: Mental Health direct 24/7,Kent and Medway Mental Health NHS Trust,Mental Health direct 24/7,"Getting Help
(goals based)","If you currently receive a service from a team at NELFT, such as a local community mental health team or a psychiatrist, then make contact with them as soon as you can. It may be helpful to refer to your care plan, which should have details of who to contact in an emergency. If it is out of office hours or you dont know who to contact, you should call NELFT Mental health direct. You can call for mental health help and advice anytime.",Mental Health Direct: 0800 995 1000,https://www.nelft.nhs.uk/services-mental-health-direct,All,"Anxiety/Depression/Low mood; Self harm; Behaviour; Special Educational Needs and Disability/ Autism/ADHD; Eating Disorder; Health; Diagnosed mental health e.g. OCD, Psychosis, Personality Disorder",All ages,N,Self Referral,Commissioned,y-Diane
Kent and Medway Mental Health NHS Trust: MIND fresh,Kent and Medway Mental Health NHS Trust,MIND fresh,Advice & Signposting,Online self help resource for CYP and parents,,https://mindfresh.nelft.nhs.uk/,All,Special Educational Needs and Disability/ Autism/ADHD; Bullying; Trauma/Victim support; Behaviour;  Self harm; Anxiety/Depression/Low mood; Eating Disorder; Bereavement; Family Support; Wellbeing,All ages,N,No referral required,Commissioned,y-Diane
Kent and Medway Mental Health NHS Trust: Neurodevelopmental & Learning Disability Services,Kent and Medway Mental Health NHS Trust,Neurodevelopmental & Learning Disability Services,"Getting more help
(specialist)","The Neurodevelopmental and Learning Disability Service for Kent and Medway is a specialist service consisting of highly skilled multidisciplinary team responsible for the assessment and diagnosis of neurodevelopmental disorders including Autism Spectrum Condition (ASC), Attention Deficit Hyperactivity Disorder (ADHD), Learning Disabilities (LD) and Tics and Tourettes syndrome (TS).

The Learning Disability team is a community based specialist service offering support to children and young people, aged between 0-18 years, who are experiencing significant mental health problems and who are diagnosed with moderate to severe learning disability.",Self refer or consultation on 08000113474,https://www.nelft.nhs.uk/nlds,Aged 11-18,Special Educational Needs and Disability/ Autism/ADHD,Secondary School Age and post 16,N,Self/Professional referral,Commissioned,y-Diane
Kent and Medway Mental Health NHS Trust: Open Road,Kent and Medway Mental Health NHS Trust,Open Road,"Getting Help
(goals based)","Open Road is a drug and alcohol recovery support charity. It provides services to support individuals on their recovery from drug and alcohol addiction.

They have a specialised Young People Service who provide honest information about how drugs and alcohol work, what the risks are and how to reduce those risks. You do not have to want to stop using to start working with them.

They can also help if you are worried about a friend or a family member and their drink and drug use.

They also have days out including Go-Ape, paintballing, the zoo, and activities such as trampolining and bowling.",Phone: 01634 471 700 or Email: wellbeing-recovery@openroad.org.uk,https://www.openroad.org.uk/our-services/our-centres/medway-young-peoples-centre/,All,Health,All ages,N,Self/Professional referral,Commissioned,y-Diane
Kent and Medway Mental Health NHS Trust: Single Point of Access - SPA,Kent and Medway Mental Health NHS Trust,Single Point of Access - SPA,Advice & Signposting,Provides consultation around mental health support and signposts to suggested support,Self refer or consultation on 08000113474,https://www.nelft.nhs.uk/services-medway-young-persons-wellbeing,All,"Anxiety/Depression/Low mood; Self harm; Behaviour; Special Educational Needs and Disability/ Autism/ADHD; Diagnosed mental health e.g. OCD, Psychosis, Personality Disorder",All ages,N,Self/Professional referral,Commissioned,y-Diane
Kent and Medway Mental Health NHS Trust: Tier 4 Inpatient interventions,Kent and Medway Mental Health NHS Trust,Tier 4 Inpatient interventions,Risk Support,"covers facilities for children and young people with mental health problems who require hospital admission. Children can be placed in a tier 4 unit either as a voluntary (informal) patient, or as a person who has been detained under the Mental Health Act 1983.",Referral from a tier 3 CAMHS intervention service,,All,"Special Educational Needs and Disability/ Autism/ADHD; Trauma/Victim support; Behaviour;  Self harm; Anxiety/Depression/Low mood;  Eating Disorder; Diagnosed mental health e.g. OCD, Psychosis, Personality Disorder",All ages,N,Professional referral,Commissioned,y-Diane
NHS: Sexual Health Services,NHS,Sexual Health Services,Advice & Signposting,"Can provide advice  guidance around sexual health. Services include supporting sexual problems which may be as a result of a psychological problem, sexual assault referral centre, abortion support etc",,https://www.nhs.uk/nhs-services/sexual-health-services/guide-to-sexual-health-services/,All,Health; LGBTQIA+,All ages,N,No referral required,NHS,y-Diane
NHS England: NHS Young People�s Health Challenge (YPHC),NHS England,NHS Young People�s Health Challenge (YPHC),Advice & Signposting,"a new toolkit to help 714-year-olds across England to find out more about the NHS. The toolkit helps children and young people to increase their health literacy, create aspirations to work or volunteer within the NHS and reduce health inequalities",,https://www.yphc.org/,7-14 year olds ,Wellbeing; Health,Primary school age and Secondary School age,N,No referral required,NHS,y-Diane
NHS England: The Solihull Approach,NHS England,The Solihull Approach,Advice & Signposting,"The Solihull Approach is a not-for-profit NHS service for practitioners and parents to support emotional health and wellbeing in children, families, adults and older adults. The sound and well-researched ideas developed by a team of clinical psychologists that underpin the Approach are embedded in every aspect of our training.",Medway families can now access some courses on the Solihull website �www.inourplace.co.uk� �for free. The courses are based on the Solihull Approach. An individual can �register on the site and then access the courses using the codeword�Invicta.,https://inourplace.co.uk/,All,Health; Wellbeing,All ages,N,No referral required,NHS,y-Diane
NHS Kent and Medway: Kent & Medway Recovery and Wellbeing College,NHS Kent and Medway,Kent & Medway Recovery and Wellbeing College,Advice & Signposting,"The Kent  Medway Recovery  Wellbeing College provides health related educational courses for adults living in Kent  Medway, free of charge,  
in supportive and accessible learning spaces.  Through education, people can make sense of their experiences and learn how to take care of themselves and others.",Self Referral via form https://kmpt-nhs.heiapply.com/eoi-form/embed/3785,https://kmpt-nhs.heiapply.com/eoi-form/embed/3785,All,Wellbeing,Post 16,N,Self Referral,commissioned,y-Diane
