Concat,Provider,Service,Ithrive,Description,Referral Process,Weblinks,Available for,Support Category,Age range,School Service,Referrer,Source,Reviewed?
A Better Medway: Education and SEND courses,A Better Medway,Education and SEND courses,Advice & Signposting,"To understand how to adapt (differentiate) work to enable all pupils to access teaching and learning. The course will give participants an understanding of why we adapt questioning, tasks and work for learners and how to do it effectively.",Self Refer: Education & SEND Courses,https://healthtraining.medway.gov.uk/search?available=true&types=%5b%22e7c8a110-61f7-11ee-a29b-b92c645347d4%22%5d,Educational Professionals ,Special Educational Needs and Disability/ Autism/ADHD,All ages,Y,Self Referral,Internal Service,y-Diane
Adult Mental Health services: Abigail's Footsteps,Adult Mental Health services,Abigail's Footsteps,"Getting Help
(goals based)","Supporting parents as they experience the devastating loss of their baby, be it before, during, or shortly after birth presents a particular challenge to staff. We offer up to 6 funded sessions designed to help you provide a high standard of individualised, compassionate care by supporting you to navigate your own feelings and reactions to the loss.",register on website ,https://www.abigailsfootsteps.co.uk,Parents,Bereavement,Secondary School Age and post 16,N,Self Referral,Commissioned Sara Moreland,y-Diane
Adult Mental Health services: Dadspace meetings ,Adult Mental Health services,Dadspace meetings ,Advice & Signposting,"Men are statistically more likely to discuss mental health issues with their barber than with their GP. This places barbers in a unique position to be able
 to help men battle anxiety and depression. The Barbershop Project will train a group of barbers as East Kent Mind Ambassadors so they can spot signs of depression, be non-judgemental listeners and effective at signposting",Contact section on website,https://www.dadspace.co.uk/,Fathers,Wellbeing; Family Support,Post 16,N,Self Referral,Commissioned Sara Moreland,y-Diane
Amparo: Specialist Suicide Bereavement Service,Amparo,Specialist Suicide Bereavement Service,Advice & Signposting,"Specialist Suicide Bereavement service for Kent and Medway. This is NOT specifically a counselling service, but will signpost to counselling as required and have their own  in house counselling. The service provides bespoke practical, emotional and social support in the aftermath of a suicide, with issues such as funeral arrangements, financial impacts, attending coroners inquests, dealing with media and anything else that may impact a family or individual by a sudden traumatic loss to suicide.

The service is open to anyone affected by a suicide either recent or historic and is open to colleagues, neighbours, schools, friends and family members, with the aim of reducing the distress and further ripple effect that a death by suicide can cause.",phone 0330 088 9255 or through their website. ,https://amparo.org.uk/our-locations/kent-medway/,All,Bereavement,All ages,N,Self Referral,Commissioned,y-Diane
Anna Freud: Crisis Messenger,Anna Freud,Crisis Messenger,advice & signposting,"a Crisis Messenger Service which is free, confidential, 247 text message support service for anyone who is feeling overwhelmed or is struggling to cope",Text: AFC to 85258,https://www.annafreud.org/afc-crisis-messenger/,All,Anxiety/Depression/Low mood,All ages,N,Self Referral,DFE/Recommended by DfE,y-Diane
Anna Freud: Mental Health Lead Resource Hub,Anna Freud,Mental Health Lead Resource Hub,Advice & Signposting,An online toolkit containing wellbeing resources and practical strategies to promote positive mental health.,see weblink,https://mentallyhealthyschools.org.uk/,Education staff ,Wellbeing,All ages,Y,No referral required,recommended by dfe,y-Diane
Anna Freud: on my mind,Anna Freud,on my mind,Advice & Signposting,online resource to empower young people to make informed choices around Mental Health  Wellbeing.,,https://www.annafreud.org/on-my-mind/,All,Wellbeing,All ages,N,No referral required,DFE/Recommended by DfE,y-Diane
Anxiety Canada: Mind Shift App,Anxiety Canada,Mind Shift App,Advice & Signposting,"A user-friendly self-help tool based on proven scientific strategies, MindShift CBT teaches about anxiety, helping users to engage in healthy thinking and to take action. Users check in each day to track their anxiety and work with tools in the app.",No referral needed,https://www.anxietycanada.com/articles/new-mindshift-cbt-app-gives-canadians-free-anxiety-relief,ages 18+,Anxiety/Depression/Low mood,Post 16,N,No referral required,Recommended by CAMHS,y-Diane
Behavioural outreach services: Fortis Outreach,Behavioural outreach services,Fortis Outreach,"Getting Help
(goals based)","The aim of the Outreach Service is to provide high-quality support and advice to enable students with SEND to succeed in the mainstream setting within Nurseries, Primary and Secondary schools.

Our work is varied and tailored according to the needs of individual schools and academies. In order to provide the best possible specialist support, the Outreach Service is provided by outstanding practitioners who have a track record of delivering change within schools to deliver improvement in SEND provision. The service is commissioned by Medway and the training and support delivered is free to Medway Schools and Academies.",See weblink for referral form,https://www.fortistrust.co.uk/outreach,Schools,Behaviour; Special Educational Needs and Disability/ Autism/ADHD,All ages,Y,Professional referral,commissioned,y-Diane
Behavioural outreach services: Marlborough outreach,Behavioural outreach services,Marlborough outreach,"Getting Help
(goals based)","Marlborough Outreach Team is a team of specialist teachers who are able to support children with ASD, Communication and Interaction Needs within the mainstream school setting. Based at the Marlborough Centre, a provision for children with a diagnosis of ASD, we are able to support children in mainstream schools and nurseries with a diagnosis of ASD andor communication and interaction needs. We provide support to children to enable them to access the curriculum and reach their full potential through providing training to school staff and working directly with children to address the difficulties that they may have which act as a barrier to their learning. We provide training in a variety of areas such as Autism Awareness and Challenging Behaviour related to Autism, but are equally able to provide a training package bespoke to meet your needs. Feel free to contact us for more information.
Eligibilityreferral criteria:
- ASD diagnosis
- Communication and Interaction Needs
- Referral through the pupils school SENCO",using the form on the website; https://hoo-st-werburgh.medway.sch.uk/marlborough-centre/outreach/meet-the-team,https://hoo-st-werburgh.medway.sch.uk/marlborough-centre,Pupils aged 3-16,Behaviour,All ages,Y,Professional referral,offered by Medway school,y-Diane
Behavioural outreach services: Rivermead,Behavioural outreach services,Rivermead,"Getting Help
(goals based)","ROCC (Rivermead Outreach Community Challenge)- Offering respite to families in Medway in school holidays and on occasional weekends. Tripple R- Rivermead Routes for Reintegration (Triple R) is the Medway Hospital PRU provision, forming the extension of Rivermead School. It is for learners with mental health needs who are either a post in-patient from a clinical provision and are receiving ongoing treatment from a psychiatrist or are currently on the CAMHS out-patient psychiatric, clinical caseload for secondary school age pupils.  The Medway Hospital school home tuition service is based at Triple R. This service is for primary and secondary aged learners across Medway who are medically illunfit to attend their home school. Triple R has three aspects: Dual Roll, Reintegration Programme and the LA Home Tuition Service (For more information on these aspects, please see the Triple R Aspects page)","Referrals for Tripple R: Enquires can be made between Monday to Friday, 8.30am � 4pm:Telephone: 01634 961080 (answerphone available for out of hours)
or Email: tripler@rivermeadinclusivetrust.org
for ROCC email: ROCC@rivermeadinclusivetrust.org
link included for Rivermead, click onto relevant pages for more information",http://www.rivermead.org.uk,Schools,Behaviour,All ages,Y,Self Referral,offered by Medway school,y-Diane
Better Health: Every mind matters,Better Health,Every mind matters,Advice & Signposting,online information and guidance to promote individuals to have good mental health and wellbeing,,https://www.nhs.uk/oneyou/every-mind-matters,All,Wellbeing,All ages,N,No referral required,NHS,y-Diane
Beyond Now: Suicide safety plan,Beyond Now,Suicide safety plan,Advice & Signposting,"Sometimes life can be overwhelming, and suicide may seem like the only way to relieve the pain. Beyond Now is an app created by Beyond Blue to support people through these feelings.","No referral process, download app on website",https://www.beyondblue.org.au/get-support/beyondnow-suicide-safety-planning,All,Suicide support and suicide bereavement,All ages,N,No referral required,ch team SH PowerPoint,y-Diane
British Red Cross: Young Refugee Project Kent ,British Red Cross,Young Refugee Project Kent ,"Getting Help
(goals based)","Works with asylum seekers and refugees aged 15-25 through a series of workshops ranging from holistic wellbeing, life skill development and building community",Contact tigony.phillips@redcross.org.uk,https://www.redcross.org.uk/get-help/get-help-as-a-young-refugee-or-asylum-seeker/,Refugees & asylum seekers,Cultural Identity & Migration Support,Post 16,N,Professional referral,commissioned by Sarah Richards,y-Diane
Brook: Confidential sexual health & wellbeing guide,Brook,Confidential sexual health & wellbeing guide,Advice & Signposting,"Free  confidential sexual health  wellbeing guide for under 25's, including additional information and resources for professionals to equip you with everything you need to provide exceptional relationships and sex education and wellbeing support to young people  from planning to policy to delivery.",,https://www.brook.org.uk/,under 25's,Wellbeing; Health,All ages,N,No referral required,Medway Care leavers services and information guide,y-Diane
Care Leavers: Ask Jan,Care Leavers,Ask Jan,advice & signposting,"Ask Jan gives care leavers access to services, including same-day support from qualified counsellors via a 24-hour telephone counselling service and the opportunity to use a network of UK-wide counsellors for face-to-face counselling within five days of requesting an appointment. The Membership Package includes:
	247 Counselling Helpline
	Face to Face Counselling
	Cognitive Behavioural Therapy
	Financial Advice  pensions, life cover, mortgages
	Housing Advice
	Advice on Legal Matters
	Debt Management
	Wellbeing Advice
	Discounts and Special Offers on Days Out and Attractions",Speak to your personal advisor,,Medway Care leavers,"Social Care; Trauma/Victim support; Behaviour; Homelessness, finance, employment; Anxiety/Depression/Low mood; Wellbeing",Post 16,N,Self/Professional referral,Commissioned,y-Diane
Care Leavers: Local offer for care leavers,Care Leavers,Local offer for care leavers,Advice & Signposting,"We have developed a Local Offer for care leavers to help you find the services and support we offer. These services can help you manage the journey into early adulthood and independent living.

Our leaving care team will help you get housing, education, training, work experience and health services. We'll also provide advice and encouragement to help you make the most of your journey through the care system.

Read more about the Local Offer for care leavers.

Find out how your personal advisor can support you.",https://www.medway.gov.uk/info/200260/local_offer_for_care_leavers,https://www.medway.gov.uk/info/200260/local_offer_for_care_leavers/,Medway Care leavers,"Social Care; Trauma/Victim support; Behaviour; Homelessness, finance, employment; Anxiety/Depression/Low mood; Wellbeing",Post 16,N,Self Referral,Internal Service,y-Diane
Citizens Advice: Money & Mental Health Advice Service ,Citizens Advice,Money & Mental Health Advice Service ,"Getting Help
(goals based)","To help those with both money and mental health issues by providing enhanced and unique offers. Citizens Advice have a dedicated team ready to help people. A specialist trained advisor will provide a unique and enhanced offer which will cover; benefits, work, debt, consumer, family, finance, housing and financial training.",email referral@nwkent.cab.org.uk,https://citizensadvicenwk.org.uk/projects/money-and-mental-health/,All,"Homelessness, finance, employment",All ages,N,Self Referral,Commissioned Sara Moreland,y-Diane
Cruse Bereavement: Bereavement service,Cruse Bereavement,Bereavement service,Advice & Signposting,Our office is staffed by volunteers who aim to  provide telephone support and advice 10am to 12.30pm Monday to Friday and answer email enquiries promptly.,Contact on 01622 671011 or email maidstone@cruse.org.uk,https://www.cruse.org.uk/,All,Bereavement,All ages,N,Self Referral,DFE/Recommended by DfE,y-Diane
Educational Psychologist: School Educational Psychologist,Educational Psychologist,School Educational Psychologist,"Getting Help
(goals based)","Support the learning, social, emotional and behavioural developments and mental health needs of  young people and have specialist skills in areas such as autism, hearing and visual impairment, speech and language and behaviour Each educational setting has a linked EP and receives a core allocation of time without charge. Additional time can be purchased to supplement this inline with he schools priorities and to improve preventative and targeted work. EP's draw on a range of approaches e.g. personal construct psychology, CBT, Solutions focussed therapy, video interactive guidance, motivational interviewing, narrative therapy, they can provide systemic interventions at school, family, community and local authority level to support change and development.",email education.psychology@medway.gov.uk or call 01634 335647,https://www.medway.gov.uk/info/200137/schools_and_learning/352/educational_psychology_service_eps,Selected schools,Behaviour; Bullying; Trauma/Victim support; Anxiety/Depression/Low mood; Bereavement; Special Educational Needs and Disability/ Autism/ADHD,All ages,Y,Professional referral,Internal Service,y-Diane
Educational Psychologist: Support following a sad event,Educational Psychologist,Support following a sad event,"Getting Help
(goals based)",The team are also able to offer support to schools and communities following a sad event such as the death of a pupilteacher,email education.psychology@medway.gov.uk or call 01634 335647,https://www.medway.gov.uk/info/200137/schools_and_learning/352/educational_psychology_service_eps,Schools,Trauma/Victim support; Anxiety/Depression/Low mood; Bereavement,All ages,Y,Professional referral,Internal Service,y-Diane
Emotional Support Team: 1:1 services - Primary parents,Emotional Support Team,1:1 services - Primary parents,"Getting Help
(goals based)","Low to moderate support around Mental Health and Wellbeing. Anxiety and understanding behaviour. Evidence based CBT informed and services based on frequency, needs and evidence base to compliment and expand on existing programmes in the school. Clinical supervision is provided to MHST practitioners by a qualified supervisor (BCAB or relevant experience)",Self referral with support of the school to the link person,https://www.nelft.nhs.uk/medway-emotional-support-team,Selected schools,Behaviour; Anxiety/Depression/Low mood; Bullying,All ages,Y,Self Referral,Commissioned,y-Diane
Emotional Support Team: 1:1 services - Primary students,Emotional Support Team,1:1 services - Primary students,"Getting Help
(goals based)","Low to moderate support around Mental Health and Wellbeing. This includes behavioural difficulties, low mood, worry management, anxietyavoidance e.g. simple phobias, separation anxiety, panic management, and supporting with alternative coping strategies, sleep hygiene, thought challenging (negative automatic thoughts) and problem solving. Practitioners may at discretion and under close supervision support around irritability, low confidence, short term phobia work, thoughts of self-harm, superficial self-harm, basic harm reduction techniques). Evidence based CBT informed and interventions based on frequency, needs and evidence base to compliment and expand on existing programmes in the school. Clinical supervision is provided to MHST practitioners by a qualified supervisor (BCAB or relevant experience)",Self referral with support of the school to the link person,https://www.nelft.nhs.uk/medway-emotional-support-team,Selected schools,Behaviour; Anxiety/Depression/Low mood; Bullying,All ages,Y,Self Referral,Commissioned,y-Diane
Emotional Support Team: 1:1 services - Secondary,Emotional Support Team,1:1 services - Secondary,"Getting Help
(goals based)","Low to moderate support around Mental Health and Wellbeing. This includes low mood, worry management, anxietyavoidance e.g. simple phobias, panic management, assessing self harm and supporting with alternative coping strategies, sleep hygiene, thought challenging (negative automatic thoughts) and problem solving. Practitioners may at discretion and under close supervision support around irritability, low confidence, short term phobia work, thoughts of self-harm, superficial self-harm, basic harm reduction techniques, rigid, ritualistic behaviour (maymay not be within an ASD diagnosis). Evidence based CBT informed and  interventions based on frequency, needs and evidence base to compliment and expand on existing programmes in the school. Clinical supervision is provided to MHST practitioners by a qualified supervisor (BCAB or relevant experience)",Self referral with support of the school to the link person,https://www.nelft.nhs.uk/medway-emotional-support-team,Selected schools,Behaviour; Anxiety/Depression/Low mood; Bullying,All ages,Y,Self Referral,Commissioned,y-Diane
Emotional Support Team: Group work CYP - Secondary,Emotional Support Team,Group work CYP - Secondary,"Getting Help
(goals based)","Targeted group work to support with difficulties such as low mood and anxiety. Evidence based CBT informed and  interventions based on frequency, needs and evidence base to compliment and expand on existing programmes in the school. Clinical supervision is provided to MHST practitioners by a qualified supervisor (BCAB or relevant experience)",Self referral with support of the school to the link person,https://www.nelft.nhs.uk/medway-emotional-support-team,Selected schools,Behaviour; Anxiety/Depression/Low mood; Bullying,All ages,Y,Self Referral,Commissioned,y-Diane
Emotional Support Team: Group work parents - Primary,Emotional Support Team,Group work parents - Primary,"Getting Help
(goals based)","Anxiety and understanding behaviour workshops- based on frequency, needs and evidence base to compliment and expand on existing programmes in the school. Clinical supervision is provided to MHST practitioners by a qualified supervisor (BCAB or relevant experience)",Self referral with support of the school to the link person,https://www.nelft.nhs.uk/medway-emotional-support-team,Selected schools,Behaviour; Anxiety/Depression/Low mood; Bullying; Family Support,All ages,Y,Self Referral,Commissioned,y-Diane
Emotional Support Team: Whole School Approach,Emotional Support Team,Whole School Approach,Thriving,Assess and support the school to implement and embed a WSA approach to Mental Health using the 8 principles from PH England. Training teachers to support interventions with children and also support staff. Proactive approach as a foundation for supporting CYP and parents. Clinical supervision is provided to MHST practitioners by a qualified supervisor (BCAB or relevant experience),Request info from Emotional Support team,https://www.nelft.nhs.uk/medway-emotional-support-team,Selected schools,Behaviour; Anxiety/Depression/Low mood; Bullying; Wellbeing,All ages,Y,Self Referral,Commissioned,y-Diane
Family Action: Medway Pregnancy to Three Support service ,Family Action,Medway Pregnancy to Three Support service ,"Getting Help
(goals based)","Support to Medway families where a parent is struggling with their emotional health or well-being during pregnancy and the first 3 years after birth. Our Pregnancy to Three Support Service is for parents who have, or are at risk of developing, mild to moderate mental health issues, including anxiety and post-natal depression",Email: medwaypregnancytothree@family-action.org.uk,https://family-action.org.uk/services/medway-pregnancy-and-early-years-wellbeing-support/,Families,Family Support,All ages,N,Self/Professional referral,Medway commissioned,y-Diane
Family Action: SENDIAS,Family Action,SENDIAS,Advice & Signposting,"Medway SENDIAS provides free and impartial help for parents or carers, children and young people. They can help you to express your views, wishes. They can also help to support you at meetings with schools and the local authority as well as help you to complete special educational needs and disability (SEND) related paperwork. Support is available for young people up to 25. They can also signpost you to other support services that may be able to help you better.",Phone: 01634 566 303 Email: medwaysendias@family-action.org.uk,https://family-action.org.uk/services/medway-sendiass/,All,Special Educational Needs and Disability/ Autism/ADHD; Family Support,All ages,N,Self/Professional referral,Commissioned,y-Diane
Family solutions: Early Help,Family solutions,Early Help,"Getting Help
(goals based)",Medway Family Solutions provides early targeted intervention (Level 2) by working holistically with families with multiple and complex needs to enable them to make changes and improvements to their lives. Can be accessed via Medway Portal (Safeguarding and Support). Family Solutions have workers called Early Help Co-ordinators and Early Help Partner Officers who work closely with Medway Partners who are Lead Practitioners and also offer Early Help Targeted Interventions (i.e. Schools),see weblink below,https://www.medway.gov.uk/info/200170/children_and_families/600/concerned_about_a_child/3,Targeted families,Family Support; Social Care,All ages,N,Self/Professional referral,Internal Service,y-Diane
Family solutions: Parenting Support Service,Family solutions,Parenting Support Service,"Getting Help
(goals based)","The Parenting Support Service deliver a set of evidence-based parenting programmes; Incredible Years aimed at parents of children aged between 511 with some level of conductbehavioural problems.
Triple P Teen aimed at parents of children aged 12-17 who have mild to serious behavioural difficulties.
Triple P ADHD aimed at parents of children aged 5-11 diagnosed with, or awaiting diagnosis of, ADHD.","Fill out the online referral form
for further information call 01634 336236 or email medwayparenting@medway.gov.uk",https://www.medway.gov.uk/info/200170/children_and_families/600/concerned_about_a_child/4#Eligibility%20Criteria,Targeted families,Family Support; Behaviour; Special Educational Needs and Disability/ Autism/ADHD; Social Care,All ages,N,Professional referral,Internal Service,y-Diane
HARMless: Self harming resource,HARMless,Self harming resource,Advice & Signposting,HARMless is a resource for those who have contact with young people who are self-harming. It is designed to help you talk about self-harm with a young person so that you can decide what support might be helpful.,,https://harmless.nhs.uk/,All,Self harm,All ages,N,No referral required,NHS,y-Diane
Holding on letting go: Bereavement service,Holding on letting go,Bereavement service,"Getting Help
(goals based)","Holding On Letting Go is a charity that helps young people (ages 6 to 16) to cope with the death of someone close to them. Support is offered to children, young people, parents and carers through bereavement support weekends.

These weekends are free to attend. They are staffed by trained volunteers. Children are encouraged to share their feelings as well as ask questions and learn strategies to help them deal with difficult emotions.",Phone: 03445 611 511 or Email: info@holg.org.uk,https://holdingonlettinggo.org.uk/,Aged 6-16,Bereavement,Primary school age and Secondary School age ,N,Self Referral,recommended by chums and various colleagues,y-Diane
Home Start: Little Adventurers,Home Start,Little Adventurers,Advice & Signposting,We will be using our experience and knowledge to provide the groups with fun and inviting activities that will support your childs learning and development! The programme will run for 6 weeks and will include lots of different themes and home learning activity ideas and resources.,"Children who have scored in the grey and black areas of their ASQ assessment, or if they are below expected level of development according to the Early Years Foundation Stage, will be offered a referral.",https://home-startmedway.org.uk/our-services/little-adventures/,Ages 1-7,Special Educational Needs and Disability/ Autism/ADHD; Health,Under 5's,N,Professional referral,Commissioned,y-Diane
